<!ELEMENT liga (equipos+)>
<!ELEMENT equipos (local, visitante, goles_local, goles_visitante)>
<!ELEMENT local (#PCDATA)>
<!ELEMENT visitante (#PCDATA)>
<!ELEMENT goles_local (#PCDATA)>
<!ELEMENT goles_visitante (#PCDATA)>